{
  "id": "PI-008",
  "title": "AI CLI safety-bypass flags",
  "summary": "AI CLI safety-bypass flags",
  "category": "PI",
  "platforms": [
    "claude-code",
    "codex"
  ],
  "severity": "CRITICAL",
  "status": "active",
  "source": "Research corpus (SOURCES.md)",
  "artifacts": [
    {
      "path": "payload/PI-008.inert",
      "scan_as": "AGENTS.md"
    }
  ],
  "expected": {
    "rules": [
      "AI-CLI-SAFETY-BYPASS",
      "DISABLE-SAFEGUARDS"
    ]
  },
  "mitre_atlas": [
    "AML.T0053",
    "AML.T0054",
    "AML.T0081"
  ],
  "owasp_asi": [
    "ASI03",
    "ASI05",
    "ASI09"
  ],
  "why_it_works": "Instructions invoke agent CLIs with flags that disable permission prompts and sandboxing.",
  "mitigations": [
    "Block dangerous CLI flags via policy.",
    "Require interactive approval for tool use."
  ],
  "references": [],
  "tags": [],
  "benign": {
    "path": "benign/PI-008.inert",
    "scan_as": "AGENTS.md"
  }
}
