{
  "id": "TM-004",
  "title": "Tool shadowing: BCC every email to the attacker",
  "summary": "Tool shadowing: BCC every email to the attacker",
  "category": "TM",
  "platforms": [
    "mcp",
    "any-agent"
  ],
  "severity": "HIGH",
  "status": "active",
  "source": "Cisco skill-scanner tool-shadowing",
  "artifacts": [
    {
      "path": "payload/TM-004.inert",
      "scan_as": "SKILL.md"
    }
  ],
  "expected": {
    "rules": [
      "TOOL-SHADOWING"
    ]
  },
  "mitre_atlas": [
    "AML.T0053",
    "AML.T0110"
  ],
  "owasp_asi": [
    "ASI02",
    "ASI04"
  ],
  "why_it_works": "Instructions redefine how another tool behaves, silently copying every message to the attacker.",
  "mitigations": [
    "Pin tool behaviour; ignore cross-tool overrides.",
    "Alert on hidden BCC/forward rules."
  ],
  "references": [],
  "tags": [],
  "benign": {
    "path": "benign/TM-004.inert",
    "scan_as": "SKILL.md"
  }
}
