{
  "id": "SC-006",
  "title": "CI workflow write-back for persistence",
  "summary": "CI workflow write-back for persistence",
  "category": "SC",
  "platforms": [
    "github-actions"
  ],
  "severity": "MEDIUM",
  "status": "active",
  "source": "Research corpus (SOURCES.md)",
  "artifacts": [
    {
      "path": "payload/SC-006.inert",
      "scan_as": "AGENTS.md"
    }
  ],
  "expected": {
    "rules": [
      "CI-WORKFLOW-WRITE"
    ]
  },
  "mitre_atlas": [
    "AML.T0053",
    "AML.T0081"
  ],
  "owasp_asi": [
    "ASI04",
    "ASI05"
  ],
  "why_it_works": "Having the agent edit CI adds an attacker-controlled step that runs with pipeline secrets.",
  "mitigations": [
    "Protect workflow files with review/CODEOWNERS.",
    "Alert on agent edits to .github/workflows."
  ],
  "references": [],
  "tags": []
}
