{
  "id": "OB-007",
  "title": "Obfuscated bootstrap: echo base64 | base64 -d | sh",
  "summary": "Obfuscated bootstrap: echo base64 | base64 -d | sh",
  "category": "OB",
  "platforms": [
    "any-agent"
  ],
  "severity": "HIGH",
  "status": "active",
  "source": "Regression rule sample",
  "artifacts": [
    {
      "path": "payload/OB-007.inert",
      "scan_as": "AGENTS.md"
    }
  ],
  "expected": {
    "rules": [
      "OBFUSCATION"
    ]
  },
  "mitre_atlas": [
    "AML.T0050",
    "AML.T0123"
  ],
  "owasp_asi": [
    "ASI01",
    "ASI05"
  ],
  "why_it_works": "Chaining base64 decode into a shell hides the real command behind an encoding step.",
  "mitigations": [
    "Block decode-to-shell pipelines.",
    "Require plain, reviewable setup commands."
  ],
  "references": [],
  "tags": [],
  "benign": {
    "path": "benign/OB-007.inert",
    "scan_as": "AGENTS.md"
  }
}
